{
  "$schema": "https://json-schema.org/draft/2020-12/schema",
  "$id": "https://zms-labs.github.io/epistemic-skills/contracts/v6-assurance/promotion-packet.schema.json",
  "title": "v6 BUILD promotion packet",
  "description": "Immutable BUILD packet identifying the candidate, evidence, known limits, rollback, and requested irreversible acts. Does not authorize PROMOTION.",
  "type": "object",
  "additionalProperties": false,
  "required": [
    "schema",
    "program",
    "issue",
    "candidate_sha",
    "generated_at",
    "readiness",
    "self_certification",
    "independent_gauntlet",
    "rollback",
    "requested_irreversible_acts",
    "blocking_claims",
    "known_limits",
    "evidence_paths"
  ],
  "properties": {
    "schema": { "const": "v6-promotion-packet@1" },
    "program": { "type": "string", "minLength": 1 },
    "issue": { "type": "integer", "minimum": 1 },
    "candidate_sha": {
      "type": "string",
      "pattern": "^[0-9a-f]{40}$"
    },
    "generated_at": { "type": "string", "minLength": 1 },
    "readiness": {
      "type": "string",
      "enum": [
        "NOT_READY",
        "READY_FOR_INDEPENDENT_GAUNTLET",
        "V6_CANDIDATE_READY_FOR_OPERATOR_ACCEPTANCE"
      ]
    },
    "self_certification": { "const": "refused" },
    "independent_gauntlet": {
      "type": "string",
      "enum": ["NOT_RUN", "GO", "CONDITIONAL", "NO-GO"]
    },
    "rollback": { "type": "string", "minLength": 1 },
    "requested_irreversible_acts": {
      "type": "array",
      "items": { "type": "string" }
    },
    "blocking_claims": {
      "type": "array",
      "items": { "type": "string", "pattern": "^CLM-[A-Z0-9-]+$" }
    },
    "known_limits": {
      "type": "array",
      "minItems": 1,
      "items": {
        "type": "object",
        "additionalProperties": false,
        "required": ["id", "kind", "statement", "release_consequence"],
        "properties": {
          "id": { "type": "string", "minLength": 1 },
          "kind": {
            "type": "string",
            "enum": ["operator-hold", "live-environment", "platform", "independence", "integrity"]
          },
          "statement": { "type": "string", "minLength": 1 },
          "release_consequence": { "type": "string", "minLength": 1 }
        }
      }
    },
    "evidence_paths": {
      "type": "array",
      "items": { "type": "string", "minLength": 1 }
    }
  }
}
